id,lng,lat,name,outlet_id
USGS-09106485,-108.5411111,39.0545833,"COLORADO R. ABV GUNNISON R. AT GRAND JUNCTION, CO",USGS-09521100
USGS-09106800,-106.6009444,38.92469444,"TAYLOR RIVER ABOVE TRAIL CREEK NR TAYLOR PARK, CO",USGS-09521100
USGS-09107000,-106.5666966,38.86027127,"TAYLOR RIVER AT TAYLOR PARK, CO.",USGS-09521100
USGS-09107500,-106.5546389,38.84694444,"TEXAS CREEK AT TAYLOR PARK, CO",USGS-09521100
USGS-09108250,-106.56075,38.8179361,"WILLOW CREEK ABOVE TAYLOR PARK RESERVOIR, CO.",USGS-09521100
USGS-09109000,-106.6091977,38.8183269,"TAYLOR RIVER BELOW TAYLOR PARK RESERVOIR, CO.",USGS-09521100
USGS-09110000,-106.8453172,38.66443715,"TAYLOR RIVER AT ALMONT, CO.",USGS-09521100
USGS-09112200,-106.8708736,38.7841599,"EAST RIVER BELOW CEMENT CREEK NR CRESTED BUTTE, CO",USGS-09521100
USGS-09112500,-106.848095,38.66443715,"EAST RIVER AT ALMONT, CO",USGS-09521100
USGS-09113500,-106.9999472,38.70304167,"OHIO CREEK NEAR BALDWIN, CO.",USGS-09521100
USGS-09113980,-106.931432,38.5877696,"OHIO CREEK ABOVE MOUTH NR GUNNISON, CO",USGS-09521100
USGS-09114500,-106.9497661,38.54193567,"GUNNISON RIVER NEAR GUNNISON, CO.",USGS-09521100
USGS-09115500,-106.422625,38.39502778,"TOMICHI CREEK AT SARGENTS, CO",USGS-09521100
USGS-09118450,-106.7736111,38.3372222,"COCHETOPA CREEK BELOW ROCK CREEK NEAR PARLIN, CO",USGS-09521100
USGS-09119000,-106.9409583,38.5211111,"TOMICHI CREEK AT GUNNISON, CO",USGS-09521100
USGS-09123450,-107.2920972,37.9843611,"LAKE FORK BLW LAKE SAN CRISTOBAL NR LAKE CITY, CO",USGS-09521100
USGS-09124010,-107.3163472,38.02566944,"HENSON CREEK AT LAKE CITY, CO",USGS-09521100
USGS-09124500,-107.2300557,38.2988834,"LAKE FORK AT GATEVIEW, CO.",USGS-09521100
USGS-09126000,-107.5461111,38.25819444,"CIMARRON RIVER NEAR CIMARRON, CO",USGS-09521100
USGS-09127000,-107.5552222,38.44694444,"CIMARRON RIVER BLW CIMARRON CREEK AT CIMARRON, CO",USGS-09521100
USGS-09128000,-107.648947,38.52915336,"GUNNISON RIVER BELOW GUNNISON TUNNEL, CO",USGS-09521100
USGS-09132050,-107.27175,38.95425,"ANTHRACITE CREEK NEAR SOMERSET, CO.",USGS-09521100
USGS-09132095,-107.3583333,38.9372222,ANTHRACITE CREEK ABOVE MOUTH NEAR SOMERSET,USGS-09521100
USGS-09132500,-107.4342211,38.9258228,"NORTH FORK GUNNISON RIVER NEAR SOMERSET, CO.",USGS-09521100
USGS-09134100,-107.6219444,38.8575,"NORTH FORK GUNNISON RIVER BELOW PAONIA, CO",USGS-09521100
USGS-09136100,-107.8334167,38.78516667,"NORTH FK GUNNISON RIVER ABOVE MOUTH NR LAZEAR, CO",USGS-09521100
USGS-09143000,-107.8545077,38.9847034,"SURFACE CREEK NEAR CEDAREDGE, CO",USGS-09521100
USGS-09144250,-108.078403,38.75303944,"GUNNISON RIVER AT DELTA, CO",USGS-09521100
USGS-09146020,-107.6831154,38.04332665,"UNCOMPAHGRE RIVER NEAR OURAY, CO",USGS-09521100
USGS-09146200,-107.7458924,38.1838791,"UNCOMPAHGRE RIVER NEAR RIDGWAY, CO.",USGS-09521100
USGS-09147025,-107.7603056,38.24055556,"UNCOMPAHGRE RIVER BELOW RIDGWAY RESERVOIR, CO",USGS-09521100
USGS-09147500,-107.779225,38.33143056,"UNCOMPAHGRE RIVER AT COLONA, CO",USGS-09521100
USGS-09149500,-108.0804167,38.74194444,"UNCOMPAHGRE RIVER AT DELTA, CO",USGS-09521100
USGS-09151500,-108.2598333,38.75694444,"ESCALANTE CREEK NEAR DELTA, CO.",USGS-09521100
USGS-09152500,-108.4506446,38.98331575,"GUNNISON RIVER NEAR GRAND JUNCTION, CO.",USGS-09521100
USGS-09163492,-108.9011667,39.21463889,"SALT CREEK NEAR MOUTH NEAR MACK, CO.",USGS-09521100
USGS-09163500,-109.0270546,39.13276047,COLORADO RIVER NEAR COLORADO-UTAH STATE LINE,USGS-09521100
USGS-09165000,-108.0603517,37.63888428,"DOLORES RIVER BELOW RICO, CO.",USGS-09521100
USGS-09166500,-108.4975908,37.47249296,"DOLORES RIVER AT DOLORES, CO.",USGS-09521100
USGS-09168730,-108.905382,38.04443666,"DOLORES RIVER NEAR SLICK ROCK, CO",USGS-09521100
USGS-09169500,-108.8853805,38.3102675,"DOLORES RIVER AT BEDROCK, CO",USGS-09521100
USGS-09171100,-108.8334347,38.3569337,"DOLORES RIVER NEAR BEDROCK, CO.",USGS-09521100
USGS-09171310,-107.8944444,37.8731111,"SOUTH FORK SAN MIGUEL RIVER NEAR OPHIR, CO",USGS-09521100
USGS-09172500,-108.1102889,38.03070556,"SAN MIGUEL RIVER NEAR PLACERVILLE, CO",USGS-09521100
USGS-09174600,-108.5020343,38.2441571,SAN MIGUEL RIVER AT BROOKS BRIDGE NEAR NUCLA CO,USGS-09521100
USGS-09177000,-108.712875,38.35721157,"SAN MIGUEL RIVER AT URAVAN, CO.",USGS-09521100
USGS-09179450,-108.9655194,38.66803889,"DOLORES RIVER NEAR GATEWAY, CO",USGS-09521100
USGS-09180000,-109.1951142,38.79720805,"DOLORES RIVER NEAR CISCO, UT",USGS-09521100
USGS-09180500,-109.2934493,38.81054095,"COLORADO RIVER NEAR CISCO, UT",USGS-09521100
USGS-09185600,-109.6583333,38.5047222,"COLORADO RIVER AT POTASH, UT",USGS-09521100
USGS-09188500,-110.1188611,43.0190833,"GREEN RIVER AT WARREN BRIDGE, NEAR DANIEL, WY",USGS-09521100
USGS-09192750,-109.8973809,43.1260559,"New Fork River ab New Fork Lakes, nr Cora, WY",USGS-09521100
USGS-09196500,-109.7735278,43.02705556,"PINE CREEK ABOVE FREMONT LAKE, WY",USGS-09521100
USGS-09201500,-109.6173664,42.8563369,"Boulder Creek above Boulder Lake, near Boulder, WY",USGS-09521100
USGS-09205000,-109.930196,42.5671427,"NEW FORK RIVER NEAR BIG PINEY, WY",USGS-09521100
USGS-09209400,-110.1632544,42.19269994,"GREEN RIVER NEAR LA BARGE, WY",USGS-09521100
USGS-09210500,-110.4160833,42.09580556,"FONTENELLE C NR HERSCHLER RANCH, NR FONTENELLE, WY",USGS-09521100
USGS-09211200,-110.0498056,42.0209722,"GREEN RIVER BELOW FONTENELLE RESERVOIR, WY",USGS-09521100
USGS-09213500,-109.5119,42.3296,"BIG SANDY RIVER NEAR FARSON, WY",USGS-09521100
USGS-09217000,-109.4490579,41.5163221,"GREEN RIVER NEAR GREEN RIVER, WY",USGS-09521100
USGS-09217900,-110.5797222,40.95902778,"BLACKS FORK NEAR ROBERTSON, WY",USGS-09521100
USGS-09218500,-110.5793647,41.03159787,"BLACKS FORK NEAR MILLBURNE, WY",USGS-09521100
USGS-09219200,-110.2059583,41.39415,"Blacks Fork above Smiths Fork, near Lyman, WY",USGS-09521100
USGS-09220000,-110.3986389,41.0538611,"EAST FORK OF SMITHS FORK NEAR ROBERTSON, WY",USGS-09521100
USGS-09223000,-110.7094167,42.11088889,"HAMS FORK BELOW POLE CREEK, NEAR FRONTIER, WY",USGS-09521100
USGS-09224700,-109.6935102,41.5460425,"BLACKS FORK NEAR LITTLE AMERICA, WY",USGS-09521100
USGS-09229500,-109.6675556,41.00452778,"HENRYS FORK NEAR MANILA, UT",USGS-09521100
USGS-09234500,-109.422914,40.90829296,"GREEN RIVER NEAR GREENDALE, UT",USGS-09521100
USGS-09237450,-106.8917667,40.2642611,"YAMPA RIVER ABOVE STAGECOACH RESERVOIR, CO",USGS-09521100
USGS-09237500,-106.8290556,40.28654444,"YAMPA RIVER BELOW STAGECOACH RESERVOIR, CO",USGS-09521100
USGS-09238900,-106.7869926,40.4749775,"FISH CR AT UPPER STA NR STEAMBOAT SPRINGS, CO",USGS-09521100
USGS-09239500,-106.8324306,40.4829861,"YAMPA RIVER AT STEAMBOAT SPRINGS, CO",USGS-09521100
USGS-09240020,-106.8415278,40.4892222,"YAMPA RIVER BELOW SODA CREEK AT STEAMBOAT SPGS, CO",USGS-09521100
USGS-09242500,-106.9539407,40.5146975,"ELK RIVER NEAR MILNER, CO.",USGS-09521100
USGS-09244490,-107.3989444,40.51793056,"YAMPA RIVER ABOVE ELKHEAD CREEK NEAR HAYDEN, CO",USGS-09521100
USGS-09246500,-107.4361735,40.5310829,"ELKHEAD CREEK NEAR CRAIG, CO",USGS-09521100
USGS-09247600,-107.6142338,40.48080479,"YAMPA RIVER BELOW CRAIG, CO.",USGS-09521100
USGS-09251000,-108.0334152,40.50274666,"YAMPA RIVER NEAR MAYBELL, CO",USGS-09521100
USGS-09253000,-107.143388,40.99941048,"LITTLE SNAKE RIVER NEAR SLATER, CO",USGS-09521100
USGS-09255000,-107.3828391,40.9824657,"SLATER FORK NEAR SLATER, CO",USGS-09521100
USGS-09255200,-107.4402583,41.01674167,"Little Snake River ab Savery Cr, nr Savery, WY",USGS-09521100
USGS-09257000,-107.5488611,41.02852778,"LITTLE SNAKE RIVER NEAR DIXON, WY",USGS-09521100
USGS-09259050,-107.6837278,41.0290111,"Little Snake R bl Gibson Blair Ditch, nr Baggs, WY",USGS-09521100
USGS-09259700,-107.9197222,41.00305556,"Little Snake River bl Dry Gulch, nr Baggs, WY",USGS-09521100
USGS-09260000,-108.4243222,40.54901667,"LITTLE SNAKE RIVER NEAR LILY, CO",USGS-09521100
USGS-09260050,-108.525101,40.45163387,"YAMPA RIVER AT DEERLODGE PARK, CO",USGS-09521100
USGS-09261000,-109.2354283,40.4093915,"GREEN RIVER NEAR JENSEN, UT",USGS-09521100
USGS-09261700,-109.4654372,40.5888323,"BIG BRUSH CRK ABV RED FLEET RES, NR VERNAL, UT",USGS-09521100
USGS-09266500,-109.6221085,40.5774426,"ASHLEY CREEK NEAR VERNAL, UT",USGS-09521100
USGS-09271000,-109.5943694,40.5141111,"ASHLEY CR NR REMEMBER THE MAINE PARK NR VERNAL, UT",USGS-09521100
USGS-09271550,-109.3876546,40.3580023,"ASHLEY CREEK BEL UNION CANAL DIV NR JENSEN, UT",USGS-09521100
USGS-09272400,-109.6758361,40.0847972,"GREEN RIVER AT OURAY, UTAH",USGS-09521100
USGS-09277500,-110.6042556,40.2997472,"DUCHESNE RIVER NEAR TABIONA, UT",USGS-09521100
USGS-09279000,-110.5772222,40.4931111,"ROCK CREEK NEAR MOUNTAIN HOME, UT",USGS-09521100
USGS-09285900,-110.7418242,40.1271783,"STRAWBERRY RIVER AT PINNACLES NEAR FRUITLAND, UT",USGS-09521100
USGS-09288000,-110.9076623,40.20023128,"CURRANT CREEK NEAR FRUITLAND, UT",USGS-09521100
USGS-09288180,-110.5548785,40.1546793,"STRAWBERRY RIVER NEAR DUCHESNE, UT",USGS-09521100
USGS-09289500,-110.5205,40.60252778,"LAKE FORK RIVER AB MOON LAKE, NR MOUNTAIN HOME, UT",USGS-09521100
USGS-09291000,-110.4846056,40.55633555,"LAKE FORK RIVER BL MOON LAKE NR MOUNTAIN HOME, UT",USGS-09521100
USGS-09292000,-110.333771,40.5463369,"YELLOWSTONE R @ BRIDGE CMPGRND NR ALTONAH, UT",USGS-09521100
USGS-09292500,-110.3415491,40.51189299,"YELLOWSTONE RIVER NEAR ALTONAH, UT",USGS-09521100
USGS-09295000,-110.0637613,40.20023757,"DUCHESNE RIVER AT MYTON, UT",USGS-09521100
USGS-09295100,-109.8598673,40.2066278,"DUCHESNE RIV ABV UINTA RIV, NR RANDLETT, UT",USGS-09521100
USGS-09296800,-110.1143226,40.5913396,"UINTA R BLW POWERPLANT DIVERSION, NR NEOLA, UT",USGS-09521100
USGS-09299500,-109.9323739,40.5935653,"WHITEROCKS RIVER NEAR WHITEROCKS, UT",USGS-09521100
USGS-09301500,-109.803777,40.23355686,"UINTA RIVER AT RANDLETT, UT",USGS-09521100
USGS-09302000,-109.7813889,40.21027778,"DUCHESNE RIVER NEAR RANDLETT, UT",USGS-09521100
USGS-09304200,-107.8253486,40.00497428,"WHITE RIVER ABOVE COAL CREEK NEAR MEEKER, CO",USGS-09521100
USGS-09304500,-107.8624194,40.03359167,"WHITE RIVER NEAR MEEKER, CO.",USGS-09521100
USGS-09304800,-108.1199444,40.0225833,"WHITE RIVER BELOW MEEKER, CO",USGS-09521100
USGS-09306290,-108.5653775,40.17969335,"WHITE RIVER BELOW BOISE CREEK, NEAR RANGELY, CO.",USGS-09521100
USGS-09306500,-109.1787269,39.97885629,"WHITE RIVER NEAR WATSON, UTAH",USGS-09521100
USGS-09310500,-111.191006,39.77440566,"FISH CREEK ABOVE RESERVOIR, NEAR SCOFIELD, UT",USGS-09521100
USGS-09311500,-111.1201697,39.78690558,"PRICE RIVER NEAR SCOFIELD, UTAH",USGS-09521100
USGS-09314250,-110.62796,39.4496734,"PRICE RIVER BL MILLER CREEK NR WELLINGTON, UT",USGS-09521100
USGS-09314500,-110.3427778,39.26444444,"PRICE RIVER AT WOODSIDE, UT",USGS-09521100
USGS-09315000,-110.1512475,38.9860831,"GREEN RIVER AT GREEN RIVER, UT",USGS-09521100
USGS-09326500,-111.2289917,39.1049972,"FERRON CREEK (UPPER STATION) NEAR FERRON, UT",USGS-09521100
USGS-09328000,-110.89065,39.1382333,"SAN RAFAEL RIVER NEAR CASTLE DALE, UTAH",USGS-09521100
USGS-09328500,-110.3701469,38.8583081,"SAN RAFAEL RIVER NEAR GREEN RIVER, UT",USGS-09521100
USGS-09328910,-110.1435278,38.7577611,"SAN RAFAEL RIVER AT MOUTH NEAR GREEN RIVER, UT",USGS-09521100
USGS-09328920,-109.9944167,38.52402778,GREEN RIVER AT MINERAL BOTTOM NR CYNLNDS NTL PARK,USGS-09521100
USGS-09328960,-110.0735389,38.01001944,"COLORADO RIVER AT GYPSUM CANYON NEAR HITE, UT",USGS-09521100
USGS-09330000,-111.5187917,38.3069248,"FREMONT RIVER NEAR BICKNELL, UT",USGS-09521100
USGS-09330500,-111.253886,38.99105556,"MUDDY CREEK NEAR EMERY, UT",USGS-09521100
USGS-09333500,-110.4074167,38.0971222,DIRTY DEVIL R AB POISON SP WSH NR HANKSVILLE UT,USGS-09521100
USGS-09342500,-107.011,37.26552778,"SAN JUAN RIVER AT PAGOSA SPRINGS, CO",USGS-09521100
USGS-09346400,-107.312267,37.01361667,"SAN JUAN RIVER NEAR CARRACAS, CO.",USGS-09521100
USGS-09349800,-107.397826,37.08833797,"PIEDRA RIVER NEAR ARBOLES, CO.",USGS-09521100
USGS-09352800,-107.5133893,37.4147242,"LOS PINOS R ABV VALLECITO RES NR BAYFIELD, CO",USGS-09521100
USGS-09352900,-107.5436688,37.47750126,"VALLECITO CREEK NEAR BAYFIELD, CO.",USGS-09521100
USGS-09353800,-107.5825,37.1661111,"LOS PINOS RIVER NEAR IGNACIO, CO",USGS-09521100
USGS-09354500,-107.5994997,37.0094484,"LOS PINOS RIVER AT LA BOCA, CO.",USGS-09521100
USGS-09355500,-107.6986389,36.80188889,"SAN JUAN RIVER NEAR ARCHULETA, NM",USGS-09521100
USGS-09357000,-107.9814417,36.699675,"SAN JUAN RIVER AT BLOOMFIELD, NM",USGS-09521100
USGS-09357700,-108.1504806,36.7078861,SAN JUAN R AT BOLACK RANCH BRDG NR FARMINGTON NM,USGS-09521100
USGS-09358000,-107.6592278,37.8111077,"ANIMAS RIVER AT SILVERTON, CO.",USGS-09521100
USGS-09358550,-107.6636723,37.8197187,"CEMENT CREEK AT SILVERTON, CO",USGS-09521100
USGS-09359010,-107.6728392,37.8027744,"MINERAL CREEK AT SILVERTON, CO",USGS-09521100
USGS-09359020,-107.6682222,37.7883333,"ANIMAS RIVER BELOW SILVERTON, CO",USGS-09521100
USGS-09359080,-107.822625,37.66727778,CASCADE CR ABV CASCADE CR DIVERSION NR ROCKWOOD CO,USGS-09521100
USGS-09359500,-107.7769667,37.59741667,"ANIMAS RIVER AT TALL TIMBER RESORT ABOVE TACOMA,CO",USGS-09521100
USGS-09361000,-107.8450944,37.4219611,"HERMOSA CREEK NEAR HERMOSA, CO.",USGS-09521100
USGS-09361500,-107.8803445,37.2791688,"ANIMAS RIVER AT DURANGO, CO",USGS-09521100
USGS-09362520,-107.8725833,37.24926389,"ANIMAS RIVER BLW DURANGO PUMP PLANT NR DURANGO, CO",USGS-09521100
USGS-09363500,-107.8753333,37.03656944,"ANIMAS RIVER NEAR CEDAR HILL, NM",USGS-09521100
USGS-09364010,-108.0229944,36.81836667,"ANIMAS RIVER BELOW AZTEC, NM",USGS-09521100
USGS-09364200,-108.1024111,36.78364167,"ANIMAS RIVER AT PENNY LANE NEAR FLORA VISTA, NM",USGS-09521100
USGS-09364500,-108.20175,36.7225,"ANIMAS RIVER AT FARMINGTON, NM",USGS-09521100
USGS-09365000,-108.2255889,36.72301667,"SAN JUAN RIVER AT FARMINGTON, NM",USGS-09521100
USGS-09367540,-108.403147,36.74028769,"SAN JUAN R NR FRUITLAND, NM",USGS-09521100
USGS-09368000,-108.6830556,36.77666667,"SAN JUAN RIVER AT SHIPROCK, NM",USGS-09521100
USGS-093710009,-108.9655,36.9823611,"MANCOS RIVER NR FOUR CORNERS, CO",USGS-09521100
USGS-09371010,-109.0295833,37.00113889,"SAN JUAN RIVER AT FOUR CORNERS, CO",USGS-09521100
USGS-09371520,-108.7006527,37.3266601,"MCELMO CREEK ABOVE TRAIL CANYON NEAR CORTEZ, CO",USGS-09521100
USGS-09372000,-109.015666,37.32415968,MCELMO CREEK NEAR COLORADO-UTAH STATE LINE,USGS-09521100
USGS-09379500,-109.8666889,37.15067778,"SAN JUAN RIVER NEAR BLUFF, UT",USGS-09521100
USGS-09380000,-111.5878722,36.8643333,"COLORADO RIVER AT LEES FERRY, AZ",USGS-09521100
USGS-383103106594200,-106.99545,38.51725556,"GUNNISON RIVER AT CNTY RD 32 BELOW GUNNISON, CO",USGS-09521100
USGS-383926107593001,-107.9922886,38.657207,LOUTSENHIZER ARROYO AT HWY 50 NEAR OLATHE CO,USGS-09521100
USGS-385106106571000,-106.9533773,38.85165929,"SLATE R AB BAXTER GL @HWY 135 NR CRESTED BUTTE, CO",USGS-09521100
USGS-385450107015700,-107.0340389,38.9144111,"SLATE RIVER ABV O-B-J CREEK NR CRESTED BUTTE, CO",USGS-09521100
USGS-391953108130201,-108.2178056,39.33119444,"ROAN CREEK AT DE BEQUE, CO.",USGS-09521100
USGS-394220106431500,-106.7258333,39.705,"EAGLE RIVER BELOW MILK CREEK NEAR WOLCOTT, CO",USGS-09521100
USGS-09394500,-110.0442837,34.7828076,"LITTLE COLORADO RIVER AT WOODRUFF, AZ",USGS-09521100
USGS-09397000,-110.1631768,34.8978039,"LITTLE COLORADO RIVER AT HOLBROOK, AZ",USGS-09521100
USGS-09398000,-110.5289306,34.92438889,"CHEVELON CREEK NEAR WINSLOW, AZ",USGS-09521100
USGS-09399400,-110.7976357,34.92141094,"JACKS CANYON CREEK NEAR WINSLOW, AZ",USGS-09521100
USGS-09400350,-110.6542806,35.006725,"LITTLE COLORADO RIVER NEAR WINSLOW, AZ",USGS-09521100
USGS-09402000,-111.5673682,35.9263819,"LITTLE COLORADO RIVER NEAR CAMERON, AZ",USGS-09521100
USGS-09402300,-111.7771024,36.1952642,"LITTLE COLORADO RIVER ABV MOUTH NR DESERT VIEW, AZ",USGS-09521100
USGS-09402500,-112.0862795,36.10137176,"COLORADO RIVER NEAR GRAND CANYON, AZ",USGS-09521100
USGS-09404115,-112.761305,36.30581618,"HAVASU CREEK ABOVE THE MOUTH, NEAR SUPAI, AZ",USGS-09521100
USGS-09404200,-113.363544,35.7735994,COLORADO RVR ABV DIAMOND CREEK NR PEACH SPRINGS AZ,USGS-09521100
USGS-09404900,-112.9585499,37.16414955,"EAST FORK VIRGIN RIVER NEAR SPRINGDALE, UT",USGS-09521100
USGS-09405500,-112.9785512,37.2097046,"NORTH FORK VIRGIN RIVER NEAR SPRINGDALE, UT",USGS-09521100
USGS-09406000,-113.1807789,37.2041494,"VIRGIN RIVER AT VIRGIN, UT",USGS-09521100
USGS-09406100,-113.285226,37.1969272,"VIRGIN RIVER AB LA VERKIN CREEK NR LA VERKIN, UT",USGS-09521100
USGS-09408135,-113.3532832,37.19248238,"VIRGIN RIVER AB QUAIL CREEK NEAR HURRICANE, UT",USGS-09521100
USGS-09408150,-113.3952285,37.16276007,"VIRGIN RIVER NEAR HURRICANE, UT",USGS-09521100
USGS-09413200,-113.5838889,37.07,"VIRGIN RIVER NEAR BLOOMINGTON, UT",USGS-09521100
USGS-09413500,-113.6805163,37.0144243,"VIRGIN RIVER NEAR ST. GEORGE, UT",USGS-09521100
USGS-09413700,-113.8313889,36.92138889,"VIRGIN RV ABV THE NARROWS NR LITTLEFIELD, AZ",USGS-09521100
USGS-09415000,-113.9244098,36.8916437,"VIRGIN RV AT LITTLEFIELD, AZ",USGS-09521100
USGS-09416000,-114.6952715,36.7110817,"MUDDY RV NR MOAPA, NV",USGS-09521100
USGS-09419000,-114.5397075,36.64302844,"MUDDY RV NR GLENDALE, NV",USGS-09521100
USGS-09419530,-114.3529139,36.4475583,"VIRGIN RV BLW CONF OF MUDDY RV NR OVERTON, NV",USGS-09521100
USGS-094196784,-115.0356667,36.13191667,"LAS VEGAS WASH AT VEGAS VALLEY DR NR LAS VEGAS, NV",USGS-09521100
USGS-09419679,-115.0219944,36.10805,"LAS VEGAS WASTEWAY NR E LAS VEGAS, NV",USGS-09521100
USGS-09419698,-115.0000505,36.09152507,"LV WASH BLW DUCK CK CONF NR HENDERSON, NV",USGS-09521100
USGS-09419700,-114.9858276,36.08747539,"LAS VEGAS WASH AT PABCO RD NR HENDERSON, NV",USGS-09521100
USGS-09419747,-114.972225,36.08978889,"LV WASH ABV BOSTICK WEIR NR HENDERSON, NV",USGS-09521100
USGS-09419749,-114.9551833,36.09420556,"LV WASH ABV HOMESTEAD WEIR NR HENDERSON, NV",USGS-09521100
USGS-09419753,-114.9433194,36.100375,"LV WASH ABV THREE KIDS WASH BLW HENDERSON, NV",USGS-09521100
USGS-09419800,-114.904992,36.12219816,"LV WASH BLW LAKE LAS VEGAS NR BOULDER CITY, NV",USGS-09521100
USGS-09424450,-113.6243774,34.46251664,"BIG SANDY RIVER NEAR WIKIEUP, AZ",USGS-09521100
USGS-09426000,-113.6088195,34.2308539,"BILL WILLIAMS RIVER BELOW ALAMO DAM, AZ",USGS-09521100
USGS-09426620,-114.0289806,34.2612361,"BILL WILLIAMS RIVER NEAR PARKER, AZ",USGS-09521100
USGS-09429070,-114.497561,33.72951944,"CRIR LWR MAIN DRAIN BLW TYSON WW, NR EHRENBERG, AZ",USGS-09521100
USGS-09429100,-114.4975389,33.7191361,"COLORADO RIVER BELOW PALO VERDE DAM, AZ-CA",USGS-09521100
USGS-09429500,-114.472111,32.86758333,"COLORADO RIVER BELOW IMPERIAL DAM, AZ-CA",USGS-09521100
USGS-09429600,-114.5149494,32.8122666,"COLORADO RIVER BELOW LAGUNA DAM, AZ-CA",USGS-09521100
USGS-09430020,-108.2419722,33.2218611,"W FORK GILA R BLW MDL FORK NR GILA HOT SPRINGS, NM",USGS-09521100
USGS-09430030,-108.2062778,33.1797222,"GILA RIVER NR GILA HOT SPRINGS, NM",USGS-09521100
USGS-09430500,-108.5373861,33.06150278,"GILA RIVER NEAR GILA, NM",USGS-09521100
USGS-09431500,-108.6755556,32.72694444,"GILA RIVER NEAR REDROCK, NM",USGS-09521100
USGS-09432000,-108.8468472,32.64630833,"GILA RIVER BELOW BLUE CREEK, NEAR VIRDEN, NM",USGS-09521100
USGS-09439000,-109.0991667,32.72444444,"GILA RIVER AT DUNCAN, AZ",USGS-09521100
USGS-09442000,-109.3086111,32.96527778,"GILA RIVER NEAR CLIFTON, AZ",USGS-09521100
USGS-09444000,-108.88,33.24716667,"SAN FRANCISCO RIVER NEAR GLENWOOD, NM",USGS-09521100
USGS-09444200,-109.1961832,33.29089456,"BLUE RIVER NEAR CLIFTON, AZ.",USGS-09521100
USGS-09444500,-109.2990167,33.05604444,"SAN FRANCISCO RIVER AT CLIFTON, AZ",USGS-09521100
USGS-09446500,-109.4923173,33.3000815,"EAGLE CREEK NR DOUBLE CIRCLE RANCH, NR MORENCI, AZ",USGS-09521100
USGS-09447000,-109.444975,33.06615,"EAGLE CREEK ABOVE PUMPING PLANT, NEAR MORENCI, AZ.",USGS-09521100
USGS-09448500,-109.4796056,32.8827222,"GILA RIVER AT HEAD OF SAFFORD VALLEY, NR SOLOMON,",USGS-09521100
USGS-09457000,-109.639262,32.8017604,"SAN SIMON RIVER NEAR SOLOMON, ARIZ.",USGS-09521100
USGS-09466500,-110.2200903,33.18561278,"GILA RIVER AT CALVA, AZ.",USGS-09521100
USGS-09469500,-110.5312109,33.1695055,"GILA RIVER BELOW COOLIDGE DAM, AZ.",USGS-09521100
USGS-09470500,-110.1112093,31.3801309,"SAN PEDRO RIVER AT PALOMINAS, AZ.",USGS-09521100
USGS-09471000,-110.1751028,31.62594167,"SAN PEDRO RIVER AT CHARLESTON, AZ",USGS-09521100
USGS-09471550,-110.2013333,31.75144444,"SAN PEDRO RIVER NEAR TOMBSTONE, AZ",USGS-09521100
USGS-09472050,-110.488275,32.44636667,"SAN PEDRO R AT REDINGTON BRIDGE NR REDINGTON, AZ",USGS-09521100
USGS-09474000,-110.9765014,33.1028404,"GILA RIVER AT KELVIN, AZ.",USGS-09521100
USGS-09482000,-110.980125,31.87150114,"SANTA CRUZ RIVER AT CONTINENTAL, AZ",USGS-09521100
USGS-09485450,-110.8289278,32.22083056,"PANTANO WASH AT BROADWAY BLVD. AT TUCSON, AZ.",USGS-09521100
USGS-09486500,-111.095875,32.3507222,"SANTA CRUZ RIVER AT CORTARO, AZ",USGS-09521100
USGS-09486520,-111.3019667,32.47158889,"SANTA CRUZ RIVER AT TRICO ROAD, NR MARANA, AZ.",USGS-09521100
USGS-09486800,-111.4042667,31.83908056,"ALTAR WASH NEAR THREE POINTS, AZ.",USGS-09521100
USGS-09487000,-111.3387473,32.0756601,"BRAWLEY WASH NEAR THREE POINTS, AZ.",USGS-09521100
USGS-09489000,-112.169593,33.23226977,"SANTA CRUZ RIVER NEAR LAVEEN, AZ.",USGS-09521100
USGS-09489500,-109.7639775,33.47672039,"BLACK RVR BLW PUMPING PLANT, NR POINT OF PINES, AZ",USGS-09521100
USGS-09490500,-110.2117674,33.71282949,"BLACK RIVER NEAR FORT APACHE, AZ.",USGS-09521100
USGS-09494000,-110.166767,33.73644059,"WHITE RIVER NEAR FORT APACHE, AZ.",USGS-09521100
USGS-09496500,-110.2809417,33.9858809,"CARRIZO CREEK NEAR SHOW LOW, AZ.",USGS-09521100
USGS-09497500,-110.4998292,33.79810588,"SALT RIVER NEAR CHRYSOTILE, AZ",USGS-09521100
USGS-09497800,-110.5576092,33.8431053,"CIBECUE CREEK NEAR CHRYSOTILE, AZ",USGS-09521100
USGS-09498500,-110.9215037,33.6194949,"SALT RIVER NEAR ROOSEVELT, AZ",USGS-09521100
USGS-09499000,-111.3034659,33.9800413,"TONTO CREEK ABOVE GUN CREEK, NEAR ROOSEVELT, AZ",USGS-09521100
USGS-09502000,-111.5765243,33.55282304,"SALT RIVER BLW STEWART MOUNTAIN DAM, AZ.",USGS-09521100
USGS-09503700,-112.3429468,34.89502016,"VERDE RIVER NEAR PAULDEN, AZ",USGS-09521100
USGS-09503990,-112.0741667,34.8648611,"SYCAMORE CREEK ABOVE VERDE RVR, NEAR CLARKDALE, AZ",USGS-09521100
USGS-09504000,-112.065994,34.8522416,"VERDE RIVER NEAR CLARKDALE, AZ",USGS-09521100
USGS-09504420,-111.7619972,34.86153889,"OAK CREEK NEAR SEDONA, AZ",USGS-09521100
USGS-09504500,-111.8909885,34.76446436,"OAK CREEK NEAR CORNVILLE, AZ",USGS-09521100
USGS-09504950,-111.8984306,34.6116972,"VERDE RIVER ABOVE CAMP VERDE, AZ",USGS-09521100
USGS-09505800,-111.6940356,34.53863606,"WEST CLEAR CREEK NEAR CAMP VERDE, AZ",USGS-09521100
USGS-09506000,-111.7898705,34.4483605,"VERDE RIVER NEAR CAMP VERDE, AZ",USGS-09521100
USGS-09507480,-111.63,34.39430556,"FOSSIL CREEK NEAR STRAWBERRY, AZ",USGS-09521100
USGS-09507980,-111.6387561,34.27642068,"EAST VERDE RIVER NEAR CHILDS, AZ",USGS-09521100
USGS-09508500,-111.7162569,34.0730922,"VERDE RVR BLW TANGLE CREEK, ABV HORSESHOE DAM, AZ",USGS-09521100
USGS-09510000,-111.6634729,33.80837509,"VERDE RIVER BELOW BARTLETT DAM, AZ",USGS-09521100
USGS-09511300,-111.6693043,33.5586557,"VERDE RIVER NEAR SCOTTSDALE, AZ",USGS-09521100
USGS-09512800,-112.1679378,34.01558948,"AGUA FRIA RIVER NEAR ROCK SPRINGS, AZ",USGS-09521100
USGS-09513860,-112.1198755,33.72920456,"SKUNK CREEK NEAR PHOENIX, AZ",USGS-09521100
USGS-09516500,-112.6621198,33.88503188,"HASSAYAMPA RIVER NEAR MORRISTOWN, AZ.",USGS-09521100
USGS-09517000,-112.7257391,33.3472844,"HASSAYAMPA RIVER NEAR ARLINGTON, AZ",USGS-09521100
USGS-09517490,-112.8818423,33.31031984,CENTENNIAL WASH AT SOUTHERN PACIFIC RAILROAD BRDG,USGS-09521100
USGS-09520500,-114.4205019,32.7608789,"GILA RIVER NEAR DOME, AZ",USGS-09521100
USGS-09520900,-114.6019333,32.72652778,"COLORADO RVR ABV OCEAN TO OCEAN BRIDGE NR YUMA, AZ",USGS-09521100
USGS-09521100,-114.6327306,32.73171354,"COLORADO R BLW YUMA MAIN CANAL WW AT YUMA, AZ",USGS-09521100
USGS-09535300,-112.3479399,31.95121357,"VAMORI WASH AT KOM VO, AZ",USGS-09535300
USGS-10011500,-110.853539,40.9652079,BEAR RIVER NEAR UTAH-WYOMING STATE LINE,USGS-10126000
USGS-10016900,-110.9636944,41.2698611,"BEAR RIVER AT EVANSTON, WY",USGS-10126000
USGS-10020100,-111.0176863,41.4343899,"BEAR RIVER ABOVE RESERVOIR, NEAR WOODRUFF, UT",USGS-10126000
USGS-10020300,-111.0146317,41.505501,"BEAR RIVER BELOW RESERVOIR, NEAR WOODRUFF, UT",USGS-10126000
USGS-10028500,-110.9868806,41.93795,"BEAR RIVER BELOW PIXLEY DAM, NEAR COKEVILLE, WY",USGS-10126000
USGS-10032000,-110.8724064,42.2932662,"SMITHS FORK NEAR BORDER, WY",USGS-10126000
USGS-10038000,-110.9731972,42.12652778,"BEAR RIVER BELOW SMITHS FORK, NR COKEVILLE, WY",USGS-10126000
USGS-10039500,-111.0538022,42.21104338,"BEAR RIVER AT BORDER, WY",USGS-10126000
USGS-10068500,-111.356875,42.4015929,BEAR RIVER AT PESCADERO ID,USGS-10126000
USGS-10092700,-111.92134,42.0129808,BEAR RIVER AT IDAHO-UTAH STATE LINE,USGS-10126000
USGS-10102220,-111.8751194,41.90695,"CUB RIVER NEAR MOUTH NEAR RICHMOND, UT",USGS-10126000
USGS-10102250,-111.881586,41.8400083,"BEAR RIVER NEAR SMITHFIELD, UT",USGS-10126000
USGS-10105900,-111.8552203,41.5754898,"LITTLE BEAR RIVER AT PARADISE, UT",USGS-10126000
USGS-10109000,-111.7839806,41.74355,"LOGAN RIVER ABOVE STATE DAM, NEAR LOGAN, UT",USGS-10126000
USGS-10113500,-111.7361639,41.62400556,"BLACKSMITH FORK AB UP and L CO.'S DAM NR HYRUM, UT",USGS-10126000
USGS-10125500,-112.2295833,42.0297222,MALAD RIVER AT WOODRUFF ID,USGS-10126000
USGS-10126000,-112.100782,41.5763213,"BEAR RIVER NEAR CORINNE, UT",USGS-10126000
USGS-10128500,-111.2479652,40.7371721,"WEBER RIVER NEAR OAKLEY, UT",USGS-10141000
USGS-10129300,-111.3704716,40.75105998,"WEBER RIVER NEAR PEOA, UTAH",USGS-10141000
USGS-10129500,-111.404918,40.79272607,"WEBER RIVER NEAR WANSHIP, UT",USGS-10141000
USGS-10130500,-111.4018633,40.89522527,"WEBER RIVER NEAR COALVILLE, UT",USGS-10141000
USGS-10131000,-111.4015858,40.92050285,"CHALK CREEK AT COALVILLE, UT",USGS-10141000
